{
  "id": "dracula",
  "name": "Dracula",
  "displayName": "🧛 Dracula",
  "description": "Dracula-inspired dark theme with purple accents",
  "category": "base",
  "colors": {
    "topBarBg": "rgb(68, 71, 90)",
    "topBarHover": "rgb(40, 42, 54)",
    "text": "rgb(248, 248, 242)",
    "bg": "rgb(40, 42, 54)",
    "bgHover": "rgb(68, 71, 90)",
    "primaryAction": "rgb(98, 114, 164)",
    "primaryActionHover": "rgb(112, 131, 189)",
    "primaryActionText": null,
    "accentGreen": "rgb(80, 250, 123)",
    "accentRed": "rgb(255, 85, 85)",
    "accentBlue": "rgb(139, 233, 253)"
  },
  "metadata": {
    "inspiration": "Dracula color scheme",
    "author": "Grantford Barnes",
    "createdAt": "2025-12-07",
    "wcagAACompliant": true
  }
}
