{
  "id": "light",
  "name": "Light",
  "displayName": "☀️ Light",
  "description": "Classic light theme with cyan accents",
  "category": "base",
  "colors": {
    "topBarBg": "rgb(200, 200, 200)",
    "topBarHover": "rgb(180, 180, 180)",
    "text": "rgb(0, 0, 0)",
    "bg": "rgb(245, 245, 245)",
    "bgHover": "rgb(234, 234, 234)",
    "primaryAction": "rgb(215, 254, 255)",
    "primaryActionHover": "rgb(182, 224, 225)",
    "primaryActionText": null,
    "accentGreen": "rgb(20, 150, 0)",
    "accentRed": "rgb(157, 0, 0)",
    "accentBlue": "rgb(0, 50, 200)"
  },
  "metadata": {
    "inspiration": "Classic light theme",
    "author": "Grantford Barnes",
    "createdAt": "2025-12-07",
    "wcagAACompliant": true
  }
}
