{
  "id": "tokyo-night-dark",
  "name": "Tokyo Night Dark",
  "displayName": "🌃 Tokyo Night Dark",
  "description": "Tokyo Night inspired dark theme",
  "category": "base",
  "colors": {
    "topBarBg": "rgb(17, 18, 26)",
    "topBarHover": "rgb(37, 38, 46)",
    "text": "rgb(169, 177, 214)",
    "bg": "rgb(26, 27, 38)",
    "bgHover": "rgb(36, 40, 59)",
    "primaryAction": "rgb(65, 72, 104)",
    "primaryActionHover": "rgb(86, 95, 137)",
    "primaryActionText": null,
    "accentGreen": "rgb(158, 206, 106)",
    "accentRed": "rgb(247, 118, 142)",
    "accentBlue": "rgb(42, 195, 222)"
  },
  "metadata": {
    "inspiration": "Tokyo Night color scheme",
    "author": "Grantford Barnes",
    "createdAt": "2025-12-07",
    "wcagAACompliant": true
  }
}
