{
  "id": "nord-polar-night",
  "name": "Nord Polar Night",
  "displayName": "❄️ Nord Polar Night",
  "description": "Nord-inspired dark theme with cool blue tones",
  "category": "base",
  "colors": {
    "topBarBg": "rgb(46, 52, 64)",
    "topBarHover": "rgb(59, 66, 82)",
    "text": "rgb(216, 222, 233)",
    "bg": "rgb(59, 66, 82)",
    "bgHover": "rgb(67, 76, 94)",
    "primaryAction": "rgb(94, 129, 172)",
    "primaryActionHover": "rgb(129, 161, 193)",
    "primaryActionText": null,
    "accentGreen": "rgb(163, 190, 140)",
    "accentRed": "rgb(191, 97, 106)",
    "accentBlue": "rgb(94, 129, 172)"
  },
  "metadata": {
    "inspiration": "Nord color palette",
    "author": "Grantford Barnes",
    "createdAt": "2025-12-07",
    "wcagAACompliant": true
  }
}
