{
  "id": "dark",
  "name": "Dark",
  "displayName": "🌙 Dark",
  "description": "Classic dark theme with teal accents",
  "category": "base",
  "colors": {
    "topBarBg": "rgb(50, 50, 50)",
    "topBarHover": "rgb(70, 70, 70)",
    "text": "rgb(255, 255, 255)",
    "bg": "rgb(34, 34, 34)",
    "bgHover": "rgb(54, 54, 54)",
    "primaryAction": "rgb(7, 72, 75)",
    "primaryActionHover": "rgb(8, 94, 99)",
    "primaryActionText": null,
    "accentGreen": "rgb(120, 255, 99)",
    "accentRed": "rgb(255, 100, 100)",
    "accentBlue": "rgb(130, 160, 255)"
  },
  "metadata": {
    "inspiration": "Classic dark theme",
    "author": "Grantford Barnes",
    "createdAt": "2025-12-07",
    "wcagAACompliant": true
  }
}
